{
  "event_id": "evt_01HYEXAMPLE",
  "event_type": "auth.requested",
  "created_at": "2026-06-10T10:00:00Z",
  "outcome": "info",
  "correlation_id": "corr_01HYEXAMPLE",
  "tool_slug": "crm",
  "actor_google_sub": null,
  "actor_email": null,
  "actor_hd": null,
  "request_ip_hash": "sha256:example",
  "user_agent_hash": "sha256:example",
  "reason_code": null,
  "metadata": {
    "return_url_host": "crm.draftapps.it"
  }
}
